{
  "schema_version": "rubric-v1",
  "view_label": "M07",
  "gold_basis": "reference_only",
  "hard_failures": [
    "json_invalid",
    "schema_invalid",
    "placeholder_corruption",
    "input_digest_mismatch",
    "unit_order_violation",
    "unit_coverage_violation",
    "private_content_exposure",
    "target_text_mismatch"
  ],
  "thresholds": {
    "placeholder_preservation": 1.0,
    "text_token_precision": 1.0,
    "text_token_recall": 1.0,
    "exact_text_match": 1.0
  },
  "task_family": "normalization",
  "prompt_version": "normalization-v1",
  "output_schema_version": "normalization-v1",
  "ordinal_thresholds": {
    "punctuation_casing": 1,
    "disfluency_handling": 1
  },
  "matching_policy": {
    "version": "normalized-token-lcs-v1",
    "tokenization": "unicode-word-or-protected-placeholder",
    "case_sensitive": false,
    "boundary_tolerance_source_units": 1
  },
  "scoring_tier": "reference_relative",
  "acceptance_scope": "reference_relative_normalization",
  "scoring_policy_version": "exact-target-v1"
}
